{
  "$id": "citable://schemas/finding.schema.json",
  "$schema": "http://json-schema.org/draft-07/schema#",
  "title": "Finding",
  "type": "object",
  "required": [
    "finding_id",
    "detector_id",
    "run_id",
    "timestamp",
    "discipline",
    "subject",
    "observation",
    "classification",
    "remediation",
    "verification",
    "status"
  ],
  "properties": {
    "schema_version": {
      "type": "integer",
      "enum": [1, 2]
    },
    "finding_id": {
      "$ref": "citable://schemas/common.defs.json#/definitions/id"
    },
    "detector_id": {
      "$ref": "citable://schemas/common.defs.json#/definitions/id"
    },
    "detector_name": {
      "type": "string"
    },
    "run_id": {
      "type": "string"
    },
    "timestamp": {
      "type": "string"
    },
    "discipline": {
      "type": "array",
      "minItems": 1,
      "items": {
        "type": "string",
        "enum": [
          "seo",
          "aeo",
          "geo",
          "agent-readiness"
        ]
      }
    },
    "subject": {
      "type": "object",
      "required": [
        "type",
        "identifier"
      ],
      "properties": {
        "type": {
          "type": "string",
          "enum": [
            "url",
            "page",
            "source_file",
            "registry_entry",
            "site",
            "schema_block",
            "link",
            "crawler",
            "claim",
            "evidence",
            "entity",
            "prompt",
            "query",
            "experiment",
            "run",
            "file"
          ]
        },
        "identifier": {
          "type": "string"
        },
        "url": {
          "type": "string"
        },
        "source_file": {
          "type": "string"
        },
        "source_location": {
          "type": "string"
        },
        "rendered_selector": {
          "type": "string"
        },
        "resource_id": {
          "type": "string"
        },
        "url_identity": {
          "type": "object"
        },
        "evidence_identity": {
          "$ref": "#/definitions/evidenceIdentity"
        }
      }
    },
    "observation": {
      "type": "object",
      "required": [
        "summary",
        "evidence"
      ],
      "properties": {
        "summary": {
          "type": "string",
          "minLength": 1
        },
        "evidence": {
          "type": "array",
          "minItems": 1,
          "items": {
            "type": "string"
          }
        },
        "captured_value": {},
        "expected_value": {},
        "evidence_identity": {
          "$ref": "#/definitions/evidenceIdentity"
        }
      }
    },
    "classification": {
      "type": "object",
      "required": [
        "finding_type",
        "severity",
        "confidence",
        "deterministic",
        "impact"
      ],
      "properties": {
        "finding_type": {
          "type": "string",
          "enum": [
            "deterministic_observation",
            "evidence_backed_semantic_finding",
            "probabilistic_inference",
            "strategic_hypothesis",
            "experiment_result",
            "untestable_condition"
          ]
        },
        "severity": {
          "type": "string",
          "enum": [
            "critical",
            "high",
            "medium",
            "low",
            "informational",
            "experimental"
          ]
        },
        "confidence": {
          "type": "string",
          "enum": [
            "confirmed",
            "high",
            "medium",
            "low",
            "unknown"
          ]
        },
        "deterministic": {
          "type": "boolean"
        },
        "impact": {
          "type": "object",
          "properties": {
            "retrieval": {
              "$ref": "#/definitions/impactLevel"
            },
            "ranking": {
              "$ref": "#/definitions/impactLevel"
            },
            "citation": {
              "$ref": "#/definitions/impactLevel"
            },
            "representation": {
              "$ref": "#/definitions/impactLevel"
            },
            "legal": {
              "$ref": "#/definitions/impactLevel"
            },
            "reputational": {
              "$ref": "#/definitions/impactLevel"
            },
            "conversion": {
              "$ref": "#/definitions/impactLevel"
            },
            "maintainability": {
              "$ref": "#/definitions/impactLevel"
            }
          }
        }
      }
    },
    "reasoning": {
      "type": "object",
      "properties": {
        "applicable_requirement": {
          "type": "string"
        },
        "explanation": {
          "type": "string"
        },
        "assumptions": {
          "type": "array",
          "items": {
            "type": "string"
          }
        },
        "limitations": {
          "type": "array",
          "items": {
            "type": "string"
          }
        }
      }
    },
    "remediation": {
      "type": "object",
      "required": [
        "preferred"
      ],
      "properties": {
        "preferred": {
          "type": "string"
        },
        "alternatives": {
          "type": "array",
          "items": {
            "type": "string"
          }
        },
        "unsafe_shortcuts": {
          "type": "array",
          "items": {
            "type": "string"
          }
        },
        "owner": {
          "type": [
            "string",
            "null"
          ]
        },
        "review_required": {
          "type": "boolean"
        }
      }
    },
    "verification": {
      "type": "object",
      "required": [
        "method"
      ],
      "properties": {
        "method": {
          "type": "string"
        },
        "expected_result": {
          "type": "string"
        },
        "detector_to_rerun": {
          "type": "string"
        }
      }
    },
    "provenance": {
      "type": "object",
      "required": [
        "detector_version",
        "tool_version",
        "evidence_source",
        "methodology",
        "revalidation_required"
      ],
      "properties": {
        "detector_version": {
          "type": "integer",
          "minimum": 1
        },
        "tool_version": {
          "type": "string"
        },
        "source_url": {
          "type": [
            "string",
            "null"
          ]
        },
        "source_file": {
          "type": [
            "string",
            "null"
          ]
        },
        "evidence_selector": {
          "type": [
            "string",
            "null"
          ]
        },
        "evidence_source": {
          "type": "string",
          "enum": [
            "dom_parse",
            "registry",
            "registry+dom_parse",
            "controlled_observation",
            "configuration"
          ]
        },
        "viewport": {
          "type": [
            "string",
            "null"
          ]
        },
        "viewport_note": {
          "type": [
            "string",
            "null"
          ]
        },
        "methodology": {
          "type": "string"
        },
        "revalidation_required": {
          "type": "string",
          "enum": [
            "on_next_audit",
            "human_review_before_action"
          ]
        }
      }
    },
    "evidence_scope": {
      "type": "object",
      "additionalProperties": false,
      "required": [
        "requirement",
        "satisfaction",
        "resource_ids",
        "coverage_ref"
      ],
      "properties": {
        "requirement": {
          "type": "string",
          "minLength": 1
        },
        "satisfaction": {
          "type": "string",
          "enum": [
            "supported",
            "qualified",
            "indeterminate",
            "not_applicable"
          ]
        },
        "resource_ids": {
          "type": "array",
          "uniqueItems": true,
          "items": {
            "type": "string"
          }
        },
        "coverage_ref": {
          "type": "string",
          "minLength": 1
        }
      }
    },
    "status": {
      "type": "object",
      "required": [
        "state"
      ],
      "properties": {
        "state": {
          "type": "string",
          "enum": [
            "open",
            "acknowledged",
            "in_remediation",
            "resolved",
            "accepted_risk",
            "false_positive"
          ]
        },
        "first_seen": {
          "type": "string"
        },
        "last_seen": {
          "type": "string"
        },
        "resolved_at": {
          "type": [
            "string",
            "null"
          ]
        },
        "occurrence_count": {
          "type": "integer",
          "minimum": 1
        },
        "persistence": {
          "type": "string",
          "enum": [
            "TRANSIENT",
            "RECURRENT",
            "PERSISTENT"
          ]
        }
      }
    }
  },
  "allOf": [
    {
      "if": {
        "required": ["schema_version"],
        "properties": {
          "schema_version": {
            "const": 2
          }
        }
      },
      "then": {
        "required": ["evidence_scope"],
        "propertyNames": {
          "enum": [
            "schema_version",
            "finding_id",
            "detector_id",
            "detector_name",
            "run_id",
            "timestamp",
            "discipline",
            "subject",
            "observation",
            "classification",
            "reasoning",
            "remediation",
            "verification",
            "provenance",
            "evidence_scope",
            "status"
          ]
        }
      }
    }
  ],
  "definitions": {
    "evidenceIdentity": {
      "type": "object",
      "additionalProperties": false,
      "required": ["hash_schema_version", "representation", "hash"],
      "properties": {
        "hash_schema_version": { "type": "string", "minLength": 1 },
        "representation": {
          "type": "string",
          "enum": ["response_body", "rendered_dom", "extracted_text", "structured_data", "evidence", "artifact"]
        },
        "hash": { "type": "string", "pattern": "^[a-f0-9]{64}$" }
      }
    },
    "impactLevel": {
      "type": "string",
      "enum": [
        "none",
        "low",
        "medium",
        "high",
        "unknown"
      ]
    }
  }
}
